{
  "$schema": "https://json-schema.org/draft/2020-12/schema",
  "$id": "https://flowtitude.com/kodavio-agent-kit/registry/report-branding.schema.json",
  "title": "Marca del kit para informes de cliente",
  "description": "Contrato de registry/report-branding.json. Lo valida scripts/validate-report-branding.py (llamado por scripts/doctor.sh). Una sola marca por kit, no por sitio (especificación 2026-08-20, sustituye a la ability kodavio/report-get-branding, deprecada en el plugin). skills/wp-client-report/SKILL.md la aplica al montar cada informe.",
  "type": "object",
  "required": ["issuer_name"],
  "properties": {
    "_meta": { "type": "object" },
    "issuer_name": {
      "type": "string",
      "minLength": 1,
      "description": "Quién firma el informe — la agencia/operador, no el sitio auditado. Único campo obligatorio."
    },
    "logo": {
      "type": ["string", "null"],
      "description": "URL o data: URI. Si falta, la portada usa solo issuer_name en tipografía grande."
    },
    "primary_color": {
      "type": "string",
      "pattern": "^#[0-9A-Fa-f]{6}$",
      "description": "Títulos, filetes, cabecera de portada. NO es el color del semáforo (ver §4 de la especificación: verde/ámbar/rojo son tokens de sistema, fijos)."
    },
    "accent_color": {
      "type": "string",
      "pattern": "^#[0-9A-Fa-f]{6}$",
      "description": "Botones/CTA de recomendaciones, acentos."
    },
    "text_color": {
      "type": "string",
      "pattern": "^#[0-9A-Fa-f]{6}$",
      "description": "Cuerpo de texto."
    },
    "font_family": {
      "type": "string",
      "minLength": 1,
      "description": "Con familias de sistema de respaldo siempre detrás (ej. \"Inter\", -apple-system, sans-serif)."
    },
    "contact": {
      "type": "object",
      "additionalProperties": false,
      "properties": {
        "email": { "type": "string" },
        "phone": { "type": "string" },
        "web": { "type": "string" }
      },
      "description": "Pie de página. Los tres subcampos son opcionales; se resuelven en footer_left/footer_right vía {correo}/{telefono}/{web}."
    },
    "legal_footer": {
      "type": "string",
      "description": "Texto legal libre (razón social, aviso de confidencialidad…). Se resuelve en footer_right vía {legal}."
    },
    "footer_left": {
      "type": "string",
      "default": "{emisor} · {correo} · {telefono} · {web}",
      "description": "Plantilla de texto libre, mitad izquierda del pie repetido. Variables: {emisor} {correo} {telefono} {web} {legal} {fecha} {sitio}. Una variable desconocida o una llave sin cerrar se dejan tal cual, visibles."
    },
    "footer_right": {
      "type": "string",
      "default": "{legal}",
      "description": "Igual que footer_left, mitad derecha. Si show_powered_by es true, \"Generado con la tecnología Kodavio.\" se añade aparte al final — no forma parte de este texto."
    },
    "show_powered_by": {
      "type": "boolean",
      "default": false,
      "description": "Si el pie menciona la tecnología Kodavio. Apagado por defecto — marca blanca total salvo activación explícita del operador (decisión 2026-08-20 §9.2)."
    }
  }
}
