{
  "_meta": {
    "descripcion": "PLANTILLA de la marca del kit para informes de cliente. Copia este archivo a report-branding.json (no versionado) y rellena con tu marca real. Una sola marca por kit, no por sitio — no se pide una por cada cliente gestionado.",
    "instrucciones": "cp registry/report-branding.example.json registry/report-branding.json — luego edita los valores. Si el fichero no existe, skills/wp-client-report/SKILL.md para y pide configurarlo antes de componer un informe.",
    "esquema": "registry/report-branding.schema.json"
  },
  "issuer_name": "Tu Agencia o Estudio S.L.",
  "logo": null,
  "primary_color": "#1B3A4B",
  "accent_color": "#C8792A",
  "text_color": "#22292F",
  "font_family": "\"Segoe UI\", Roboto, \"Helvetica Neue\", Arial, sans-serif",
  "contact": {
    "email": "hola@tuagencia.example",
    "phone": "+34 900 000 000",
    "web": "tuagencia.example"
  },
  "legal_footer": "Tu Agencia o Estudio S.L. · Informe confidencial preparado para uso exclusivo del destinatario · No redistribuir sin autorización.",
  "footer_left": "{emisor} · {correo} · {telefono} · {web}",
  "footer_right": "{legal}",
  "show_powered_by": false
}
